{
  "mode": "custom_code",
  "config": {
    "plugin": "nested_circles_v4",
    "config": {}
  },
  "code": "window.EXPLAINER_VIZ = (function() {  var svg, config;  var fills = {}, strks = {}, rLab = {}, kLab = {};  function svgEl(tag, attrs, parent) {    var e = document.createElementNS('http://www.w3.org/2000/svg', tag);    for (var k in attrs) e.setAttribute(k, attrs[k]);    if (parent) parent.appendChild(e);    return e;  }  return {    name: 'nested_circles_v4',    init: function(svgElement, vizConfig) {      svg = svgElement;      config = vizConfig;      var N = 8;\n      for (var r = 1; r <= N; r++) {        var fillColor = r % 2 === 0 ? 'rgba(245,158,11,0.5)' : '#0f0e17';        fills[r] = svgEl('circle', {          cx: 250,          cy: 250 - r * 25,          r: r * 25,          fill: fillColor,          opacity: 0        }, svg);        strks[r] = svgEl('circle', {          cx: 250,          cy: 250 - r * 25,          r: r * 25,          fill: 'none',          stroke: '#818cf8',          'stroke-width': 1.5,          'stroke-dasharray': 2 * Math.PI * (r * 25),          'stroke-dashoffset': 2 * Math.PI * (r * 25),          opacity: 1        }, svg);        rLab[r] = svgEl('text', {          x: 250 + r * 25 + 10,          y: 250 - r * 25,          fill: 'rgba(255,255,255,0.5)',          'font-size': 11,          opacity: 0        }, svg);        rLab[r].textContent = 'r = ' + r;      }    },    timelineAction: function(tl, method, params, t) {      switch (method) {        case 'drawCircle':          var r = params.radius;          tl.to(strks[r], { strokeDashoffset: 0, duration: 1.6, ease: 'power2.inOut' }, t);          tl.to(fills[r], { opacity: 1, duration: 0.5 }, t + 1.0);          tl.to(rLab[r], { opacity: 1, duration: 0.3 }, t + 0.3);          break;        case 'highlightShadedArea':          var r1 = params.r1, r2 = params.r2;          tl.to(fills[r1], { opacity: 0.5, duration: 0.5 }, t);          tl.to(fills[r2], { opacity: 1, duration: 0.5 }, t + 0.5);          break;        case 'fadeInFormula': break;        case 'drawGraph': break;        case 'highlightIntersection': break;      }    },    executeAction: function(actionDef, tl, t) {      this.timelineAction(tl, actionDef.method, actionDef.params, t);    }  };})();",
  "actions_implemented": [
    "drawCircle",
    "highlightShadedArea",
    "fadeInFormula",
    "drawGraph",
    "highlightIntersection"
  ]
}