{
  "mode": "custom_code",
  "config": {
    "plugin": "nested_circles",
    "config": {
      "cx": 250,
      "baseY": 250,
      "scale": 28,
      "circleCount": 8,
      "darkColor": "#0f0e17",
      "strokeColor": "#818cf8",
      "finalCount": 64,
      "finalScale": 3.4
    }
  },
  "code": "window.EXPLAINER_VIZ = (function() {\n  var svg, config;\n  var fills = {}, strokes = {}, rLab = {}, kLab = {};\n  var fG, sG, lG, annotG;\n  var cDot, cLabel;\n  \n  function svgEl(tag, attrs, parent) {\n    var e = document.createElementNS('http://www.w3.org/2000/svg', tag);\n    for (var k in attrs) e.setAttribute(k, attrs[k]);\n    if (parent) parent.appendChild(e);\n    return e;\n  }\n\n  return {\n    name: 'nested_circles',\n\n    init: function(svgElement, vizConfig) {\n      svg = svgElement;\n      config = vizConfig;\n      var CX = config.cx, BY = config.baseY, S = config.scale;\n      var N = config.circleCount;\n      var DARK = config.darkColor;\n      var SC = config.strokeColor;\n\n      /* Background */\n      svgEl('rect', { width: '500', height: '500', fill: DARK }, svg);\n\n      /* Groups */\n      fG = svgEl('g', {}, svg);\n      sG = svgEl('g', {}, svg);\n      lG = svgEl('g', {}, svg);\n      annotG = svgEl('g', {}, svg);\n\n      /* Common point */\n      cDot = svgEl('circle', { cx: CX, cy: BY, r: '5', fill: '#f59e0b', opacity: '0' }, svg);\n      cLabel = svgEl('text', {\n        x: CX, y: BY + 20, 'text-anchor': 'middle',\n        fill: 'rgba(255,255,255,0.5)', 'font-size': '10', opacity: '0', 'font-family': 'system-ui'\n      }, svg);\n      cLabel.textContent = 'common point';\n\n      /* Filled circles */\n      for (var r = N; r >= 1; r--) {\n        fills[r] = svgEl('circle', {\n          cx: CX, cy: BY - r * S, r: r * S,\n          fill: r % 2 === 0 ? 'rgba(99,102,241,0.55)' : DARK,\n          opacity: '0'\n        }, fG);\n      }\n\n      /* Stroke circles + labels */\n      for (var r = 1; r <= N; r++) {\n        var ci = 2 * Math.PI * r * S;\n        strokes[r] = svgEl('circle', {\n          cx: CX, cy: BY - r * S, r: r * S,\n          fill: 'none', stroke: SC, 'stroke-width': '1.5',\n          'stroke-dasharray': ci, 'stroke-dashoffset': ci,\n          opacity: '0.7',\n          transform: 'rotate(90 ' + CX + ' ' + (BY - r * S) + ')'\n        }, sG);\n\n        rLab[r] = svgEl('text', {\n          x: CX + r * S + 12, y: BY - r * S,\n          'text-anchor': 'start', 'dominant-baseline': 'central',\n          fill: 'rgba(255,255,255,0.5)', 'font-size': '11', opacity: '0',\n          'font-family': 'system-ui'\n        }, lG);\n        rLab[r].textContent = 'r = ' + r;\n      }\n\n      /* K labels */\n      var kCount = Math.floor(N / 2);\n      for (var k = 1; k <= kCount; k++) {\n        var midY = BY - (4 * k - 1) * S / 2;\n        kLab[k] = svgEl('text', {\n          x: CX, y: midY, 'text-anchor': 'middle', 'dominant-baseline': 'central',\n          fill: '#e0e7ff', 'font-size': '13', 'font-weight': '700', opacity: '0',\n          'font-family': 'system-ui'\n        }, lG);\n        kLab[k].textContent = 'k = ' + k;\n      }\n    },\n\n    timelineAction: function(tl, method, params, t) {\n      var CX = config.cx, BY = config.baseY, S = config.scale;\n      var N = config.circleCount;\n\n      switch(method) {\n        case 'drawCircle': {\n          var r = params.radius;\n          tl.to(strokes[r], { strokeDashoffset: 0, duration: 1.6, ease: 'power2.inOut' }, t);\n          tl.to(fills[r], { opacity: 1, duration: 0.5 }, t + 1.0);\n          tl.to(rLab[r], { opacity: 1, duration: 0.3 }, t + 0.3);\n          if (r % 2 === 0) {\n            var k = r / 2;\n            tl.to(kLab[k], { opacity: 1, duration: 0.35 }, t + 1.3);\n          }\n          break;\n        }\n\n        case 'highlightShadedArea': {\n          var r1 = params.r1, r2 = params.r2;\n          tl.to(fills[r2], { attr: { fill: 'rgba(245,158,11,0.55)' }, duration: 0.5 }, t);\n          tl.to(strokes[r1], { attr: { stroke: '#f59e0b' }, duration: 0.4 }, t);\n          tl.to(strokes[r2], { attr: { stroke: '#f59e0b' }, duration: 0.4 }, t + 0.1);\n          break;\n        }\n\n        case 'fadeInFormula': {\n          var formula = svgEl('text', {\n            x: CX, y: 50, 'text-anchor': 'middle',\n            fill: '#e0e7ff', 'font-size': '16', 'font-weight': '700',\n            'font-family': 'system-ui', opacity: '0'\n          }, annotG);\n          formula.textContent = params.formula || '';\n          tl.to(formula, { opacity: 1, y: '-=4', duration: 0.6, ease: 'power2.out' }, t);\n          break;\n        }\n\n        case 'drawGraph': {\n          var graphGroup = svgEl('g', { opacity: '0' }, svg);\n          \n          /* Graph axes */\n          svgEl('line', {\n            x1: 100, y1: 400, x2: 400, y2: 400,\n            stroke: '#818cf8', 'stroke-width': '1.5'\n          }, graphGroup);\n          svgEl('line', {\n            x1: 100, y1: 100, x2: 100, y2: 400,\n            stroke: '#818cf8', 'stroke-width': '1.5'\n          }, graphGroup);\n          \n          /* Graph curve */\n          var path = svgEl('path', {\n            d: 'M100,400',\n            fill: 'none', stroke: '#f59e0b', 'stroke-width': '2'\n          }, graphGroup);\n          \n          /* Equation label */\n          var eqLabel = svgEl('text', {\n            x: 250, y: 50, 'text-anchor': 'middle',\n            fill: '#e0e7ff', 'font-size': '14', 'font-weight': '700',\n            'font-family': 'system-ui'\n          }, graphGroup);\n          eqLabel.textContent = params.equation || '';\n          \n          tl.to(graphGroup, { opacity: 1, duration: 0.8 }, t);\n          break;\n        }\n\n        case 'highlightIntersection': {\n          var x = params.x;\n          var dot = svgEl('circle', {\n            cx: 100 + (300 * x / 100), cy: 400 - (300 * 2023 / 3200),\n            r: '6', fill: '#f59e0b', opacity: '0'\n          }, svg);\n          tl.to(dot, { opacity: 1, duration: 0.5, ease: 'back.out(2)' }, t);\n          break;\n        }\n      }\n    },\n\n    executeAction: function(actionDef, tl, t) {\n      this.timelineAction(tl, actionDef.method, actionDef.params || {}, t);\n    }\n  };\n})();",
  "actions_implemented": [
    "drawCircle",
    "highlightShadedArea",
    "fadeInFormula",
    "drawGraph",
    "highlightIntersection"
  ]
}